<?xml version="1.0" encoding="UTF-8"?>
<robot xmlns:xsi="http://www.w3.org/2001/XMLSchema-instance" xsi:noNamespaceSchemaLocation="moves.xsd">
	<low_skills>
		<low_skill name="filipskuska" firstPhase="filipskuska">
			<type>skuska</type>
			<author>Filip Blanarik</author>
			<extendedFromMove></extendedFromMove>
			<description>Hrac hybe rukami a hlavou</description>
		</low_skill>
	</low_skills>
	
  <phases>
    <phase name="filipskuska" next="filipskuska1">
      <effectors>
	<he1 end="0" />
		<he2 end="45" />
	<rae2 end="0" />
	<lae2 end="0" />
	<rae3 end="0" />
	<lae3 end="0" />
	<rae4 end="0" />
	<lae4 end="0" />
	<rle1 end="0" />
	<lle1 end="0" />
	<rle2 end="0" />
	<lle2 end="0" />
	<rle3 end="0" />
	<lle3 end="0" />
	<rle4 end="0" />
	<lle4 end="0" />
	<rle5 end="0" />
	<lle5 end="0" />
	<rle6 end="0" />
	<lle6 end="0" />
        <lae1 end="90" />
        <rae1 end="90" />
      </effectors>
      <duration>400</duration>
    </phase>
    <phase name="filipskuska1" next="filipskuska2">
      <effectors>
        <he2 end="-45" />
	    <rae1 end="0" />
		<lae1 end="0" />
      </effectors>
      <duration>400</duration>
    </phase>
	<phase name="filipskuska2" next="filipskuska3">
      <effectors>
        <he2 end="45" />
	    <rae1 end="90" />
		<lae1 end="90" />
      </effectors>
      <duration>400</duration>
    </phase>
    <phase name="filipskuska3" isFinal="true">
      <effectors>
        <he2 end="0" />
	    <rae1 end="0" />
		<lae1 end="0" />
      </effectors>
      <duration>400</duration>
      <finalize>filipskuska</finalize>
    </phase>
  </phases>
</robot>