<?xml version="1.0" encoding="UTF-8"?>
<robot xmlns:xsi="http://www.w3.org/2001/XMLSchema-instance" xsi:noNamespaceSchemaLocation="moves.xsd">
  <low_skills>
    <low_skill name="nahlavu" firstPhase="nahlavu">
      <type>fall</type>
      <author>Androids</author>
      <extendedFromMove></extendedFromMove>
      <description>Player falls to the front. Move is less effective.</description>
    </low_skill>
  </low_skills>

  <phases>
    <phase name="nahlavu" next="nahlavu1">
      <effectors>
        <he1 end="0"/>
        <he2 end="0"/>
        <rae2 end="0"/>
        <lae2 end="0"/>
        <rae3 end="0"/>
        <lae3 end="0"/>
        <rae4 end="0"/>
        <lae4 end="0"/>
        <rle1 end="0"/>
        <lle1 end="0"/>
        <rle2 end="0"/>
        <lle2 end="0"/>
        <rle3 end="0"/>
        <lle3 end="0"/>
        <rle4 end="0"/>
        <lle4 end="0"/>
        <rle5 end="0"/>
        <lle5 end="0"/>
        <rle6 end="0"/>
        <lle6 end="0"/>
        <lae1 end="-90"/>
        <rae1 end="-90"/>
      </effectors>
      <duration>400</duration>
    </phase>
    <phase name="nahlavu1" next="nahlavu2">
      <effectors>

      </effectors>
      <duration>100</duration>
    </phase>
    <phase name="nahlavu2" next="nahlavu3">
      <effectors>
        <lae1 end="28"/>
        <rae1 end="28"/>
        <rle3 end="100"/>
        <lle3 end="100"/>
        <rle4 end="-120"/>
        <lle4 end="-120"/>

      </effectors>
      <duration>2000</duration>
    </phase>
    <phase name="nahlavu3" next="nahlavu4">
      <effectors>
        <rle2 end="-120"/>
        <lle2 end="120"/>

        <rle3 end="60"/>
        <lle3 end="60"/>
        <rle4 end="0"/>
        <lle4 end="0"/>
        <rle5 end="-90"/>
        <lle5 end="-90"/>
        <rle1 end="-90"/>
        <lle1 end="-90"/>
      </effectors>
      <duration>1000</duration>
    </phase>
    <phase name="nahlavu4" next="nahlavu5">
      <effectors>
        <rle2 end="0"/>
        <lle2 end="0"/>

        <rle3 end="0"/>
        <lle3 end="0"/>
        <rle4 end="0"/>
        <lle4 end="0"/>
        <rle5 end="0"/>
        <lle5 end="0"/>
        <rle1 end="0"/>
        <lle1 end="0"/>

      </effectors>
      <duration>1500</duration>
    </phase>
    <phase name="nahlavu5" next="nahlavu6">
      <effectors>
        <rle2 end="-120"/>
        <lle2 end="120"/>

        <rle3 end="60"/>
        <lle3 end="60"/>
        <rle4 end="0"/>
        <lle4 end="0"/>
        <rle5 end="-90"/>
        <lle5 end="-90"/>
        <rle1 end="-90"/>
        <lle1 end="-90"/>

      </effectors>
      <duration>1500</duration>
    </phase>
    <phase name="nahlavu6" next="nahlavu7">
      <effectors>
        <rle2 end="0"/>
        <lle2 end="0"/>

        <rle3 end="0"/>
        <lle3 end="0"/>
        <rle4 end="0"/>
        <lle4 end="0"/>
        <rle5 end="0"/>
        <lle5 end="0"/>
        <rle1 end="0"/>
        <lle1 end="0"/>

      </effectors>
      <duration>1500</duration>
    </phase>
    <phase name="nahlavu7" next="nahlavu8">
      <effectors>
        <rle2 end="-120"/>
        <lle2 end="120"/>

        <rle3 end="60"/>
        <lle3 end="60"/>
        <rle4 end="0"/>
        <lle4 end="0"/>
        <rle5 end="-90"/>
        <lle5 end="-90"/>
        <rle1 end="-90"/>
        <lle1 end="-90"/>

      </effectors>
      <duration>1500</duration>
    </phase>
    <phase name="nahlavu8" next="nahlavu9">
      <effectors>
        <rle2 end="0"/>
        <lle2 end="0"/>

        <rle3 end="0"/>
        <lle3 end="0"/>
        <rle4 end="0"/>
        <lle4 end="0"/>
        <rle5 end="0"/>
        <lle5 end="0"/>
        <rle1 end="0"/>
        <lle1 end="0"/>

      </effectors>
      <duration>1500</duration>
    </phase>

    <phase name="nahlavu9" next="nahlavuf">
      <effectors>
        <lae1 end="28"/>
        <rae1 end="28"/>
        <rle3 end="100"/>
        <lle3 end="100"/>
        <rle4 end="-120"/>
        <lle4 end="-120"/>

      </effectors>
      <duration>2000</duration>
    </phase>


    <phase name="nahlavuf" isFinal="true">
      <effectors>

      </effectors>
      <duration>100</duration>
      <finalize>nahlavu</finalize>
    </phase>
  </phases>
</robot>