<?xml version="1.0" encoding="UTF-8"?>
<robot xmlns:xsi="http://www.w3.org/2001/XMLSchema-instance" xsi:noNamespaceSchemaLocation="moves.xsd">
  <low_skills>
    <low_skill name="hlavaaruky" firstPhase="hlavaaruky">
      <type>fall</type>
      <author>Androids</author>
      <extendedFromMove></extendedFromMove>
      <description>Player falls to the front. Move is less effective.</description>
    </low_skill>
  </low_skills>

  <phases>
    <phase name="hlavaaruky" next="hlavaaruky1">
      <effectors>
        <he1 end="0"/>
        <he2 end="0"/>
        <rae2 end="0"/>
        <lae2 end="0"/>
        <rae3 end="0"/>
        <lae3 end="0"/>
        <rae4 end="0"/>
        <lae4 end="0"/>
        <rle1 end="0"/>
        <lle1 end="0"/>
        <rle2 end="0"/>
        <lle2 end="0"/>
        <rle3 end="0"/>
        <lle3 end="0"/>
        <rle4 end="0"/>
        <lle4 end="0"/>
        <rle5 end="0"/>
        <lle5 end="0"/>
        <rle6 end="0"/>
        <lle6 end="0"/>
        <lae1 end="-90"/>
        <rae1 end="-90"/>
      </effectors>
      <duration>400</duration>
    </phase>
    <phase name="hlavaaruky1" next="hlavaaruky2">
      <effectors>
        <he1 end="-90"/>
        <rae1 end="-180"/>
        <lae1 end="180"/>
      </effectors>
      <duration>800</duration>
    </phase>
    <phase name="hlavaaruky2" next="hlavaaruky3">
      <effectors>
        <he1 end="90"/>
        <rae1 end="180"/>
        <lae1 end="-180"/>
      </effectors>
      <duration>1600</duration>
    </phase>
    <phase name="hlavaaruky3" isFinal="true">
      <effectors>

      </effectors>
      <duration>100</duration>
      <finalize>hlavaaruky</finalize>
    </phase>
  </phases>
</robot>