<?xml version="1.0" encoding="UTF-8"?>
<robot xmlns:xsi="http://www.w3.org/2001/XMLSchema-instance" xsi:noNamespaceSchemaLocation="moves.xsd">
  <low_skills>
    <low_skill name="drepyII" firstPhase="drepyII">
      <type>fall</type>
      <author>Androids</author>
      <extendedFromMove></extendedFromMove>
      <description>Player falls to the back. Move is fast and effective.</description>
    </low_skill>
  </low_skills>

  <phases>
    <phase name="drepyII" next="drepyII3">
      <effectors>
        <he1 end="0"/>
        <he2 end="0"/>
        <rae2 end="0"/>
        <lae2 end="0"/>
        <rae3 end="0"/>
        <lae3 end="0"/>
        <rae4 end="0"/>
        <lae4 end="0"/>
        <rle1 end="0"/>
        <lle1 end="0"/>
        <rle2 end="0"/>
        <lle2 end="0"/>
        <rle3 end="0"/>
        <lle3 end="0"/>
        <rle4 end="0"/>
        <lle4 end="0"/>
        <rle6 end="0"/>
        <lle6 end="0"/>
        <lae1 end="-90"/>
        <rae1 end="-90"/>
        <rle5 end="0"/>
        <lle5 end="0"/>
      </effectors>
      <duration>500</duration>
    </phase>

    <phase name="drepyII3" next="drepyII4">
      <effectors>
        <rle1 end="-60"/>
        <lle1 end="-60"/>
        <rle2 end="-45"/>
        <lle2 end="45"/>
        <rle3 end="100"/>
        <lle3 end="100"/>
        <rle4 end="-90"/>
        <lle4 end="-90"/>
        <rle5 end="65"/>
        <lle5 end="65"/>
        <rae1 end="-90"/>
        <lae1 end="-90"/>
      </effectors>
      <duration>3000</duration>
    </phase>


    <phase name="drepyII4" next="drepyIIf">
      <effectors>
        <he1 end="0"/>
        <he2 end="0"/>
        <rae2 end="0"/>
        <lae2 end="0"/>
        <rae3 end="0"/>
        <lae3 end="0"/>
        <rae4 end="0"/>
        <lae4 end="0"/>
        <rle1 end="0"/>
        <lle1 end="0"/>
        <rle2 end="0"/>
        <lle2 end="0"/>
        <rle3 end="0"/>
        <lle3 end="0"/>
        <rle4 end="0"/>
        <lle4 end="0"/>
        <rle6 end="0"/>
        <lle6 end="0"/>
        <lae1 end="-90"/>
        <rae1 end="-90"/>
        <rle5 end="0"/>
        <lle5 end="0"/>
      </effectors>
      <duration>2000</duration>
    </phase>

    <phase name="drepyIIf" isFinal="true">
      <effectors>

      </effectors>
      <duration>100</duration>
      <finalize>drepyII</finalize>
    </phase>
  </phases>
</robot>