<?xml version="1.0" encoding="UTF-8"?>
<robot xmlns:xsi="http://www.w3.org/2001/XMLSchema-instance" xsi:noNamespaceSchemaLocation="moves.xsd">
  <low_skills>
    <low_skill name="walk_slow" firstPhase="walk_slow_1">
      <type>walk</type>
      <author>Androids</author>
      <extendedFromMove>walk_fine</extendedFromMove>
      <description>Player performs straight walk. Move is stable but very slow.</description>
    </low_skill>
  </low_skills>

  <phases>
    <phase name="walk_slow_1" next="walk_slow_2">
      <effectors>
        <he1 end="0"/>
        <he2 end="0"/>
        <rle1 end="0"/>
        <lle1 end="0"/>
        <rle2 end="7"/>
        <lle2 end="-7"/>
        <rle3 end="40"/>
        <lle3 end="40"/>
        <rle4 end="-55"/>
        <lle4 end="-55"/>
        <rle5 end="30"/>
        <lle5 end="30"/>
        <rle6 end="-7"/>
        <lle6 end="7"/>
        <rae1 end="-90"/>
        <lae1 end="-90"/>
        <rae2 end="-10"/>
        <lae2 end="10"/>
        <rae3 end="90"/>
        <lae3 end="-90"/>
        <rae4 end="45"/>
        <lae4 end="-45"/>
      </effectors>
      <duration>700</duration>
    </phase>
    <phase name="walk_slow_2" next="walk_slow_3">
      <effectors>
        <rle3 end="60"/>
        <rle4 end="-80"/>
        <rle5 end="40"/>
        <lle3 end="40"/>
        <lle4 end="-55"/>
        <lle5 end="30"/>
        <rae1 end="-90"/>
        <lae1 end="-90"/>
      </effectors>
      <duration>150</duration>
    </phase>
    <phase name="walk_slow_3" next="walk_slow_4">
      <effectors>
        <rle3 end="40"/>
        <rle4 end="-55"/>
        <rle5 end="30"/>
        <lle3 end="45"/>
        <lle4 end="-70"/>
        <lle5 end="40"/>
        <rae1 end="-110"/>
        <lae1 end="-70"/>
      </effectors>
      <duration>150</duration>
    </phase>
    <phase name="walk_slow_4" next="walk_slow_5">
      <effectors>
        <lle3 end="60"/>
        <lle4 end="-80"/>
        <lle5 end="40"/>
        <rle3 end="40"/>
        <rle4 end="-55"/>
        <rle5 end="30"/>
        <rae1 end="-90"/>
        <lae1 end="-90"/>
      </effectors>
      <duration>150</duration>
    </phase>
    <phase name="walk_slow_5" next="walk_slow_2" isFinal="true">
      <effectors>
        <lle3 end="40"/>
        <lle4 end="-55"/>
        <lle5 end="30"/>
        <rle3 end="45"/>
        <rle4 end="-70"/>
        <rle5 end="40"/>
        <rae1 end="-70"/>
        <lae1 end="-110"/>
      </effectors>
      <duration>150</duration>
      <finalize>walk_slow_6</finalize>
    </phase>
    <phase name="walk_slow_6" isFinal="true">
      <effectors>

        <he2 end="0"/>

        <rae1 end="-90"/>
        <lae1 end="-90"/>
        <rae2 end="-10"/>
        <lae2 end="10"/>
        <rae3 end="80"/>
        <lae3 end="-80"/>
        <rae4 end="60"/>
        <lae4 end="-60"/>

        <rle1 end="0"/>
        <lle1 end="0"/>
        <rle2 end="0"/>
        <lle2 end="0"/>
        <rle3 end="40"/>
        <lle3 end="40"/>
        <rle4 end="-60"/>
        <lle4 end="-60"/>
        <rle5 end="30"/>
        <lle5 end="30"/>
        <rle6 end="0"/>
        <lle6 end="0"/>
      </effectors>
      <duration>400</duration>
      <finalize>walk_slow_1</finalize>
    </phase>
  </phases>
</robot>
