<?xml version="1.0" encoding="UTF-8"?>
<robot xmlns:xsi="http://www.w3.org/2001/XMLSchema-instance" xsi:noNamespaceSchemaLocation="moves.xsd">

  <low_skills>
    <low_skill name="kick_right_faster" firstPhase="kick_right_faster_default">
      <type>kick</type>
      <author>Gabor Nagy (A55 kickers)</author>
      <extendedFromMove>kick_right_faster</extendedFromMove>
      <description>Player performs straight kick with left foot. Move is faster than kick_left_normal and stable. Player
        rotates 5Â° after kick
      </description>
    </low_skill>
  </low_skills>

  <phases>
    <phase name="kick_right_faster_default" next="kick_right_faster_Phase0">
      <effectors>
        <he2 end="0"/>

        <rae1 end="-90"/>
        <lae1 end="-90"/>
        <rae2 end="-10"/>
        <lae2 end="10"/>
        <rae3 end="80"/>
        <lae3 end="-80"/>
        <rae4 end="60"/>
        <lae4 end="-60"/>

        <rle1 end="0"/>
        <lle1 end="0"/>
        <rle2 end="0"/>
        <lle2 end="0"/>
        <rle3 end="40"/>
        <lle3 end="40"/>
        <rle4 end="-60"/>
        <lle4 end="-60"/>
        <rle5 end="30"/>
        <lle5 end="30"/>
        <rle6 end="0"/>
        <lle6 end="0"/>
      </effectors>
      <duration>500</duration>
    </phase>
    <phase name="kick_right_faster_Phase0" next="kick_right_faster_Phase1">
      <effectors>
        <he1 end="0"/>
        <he2 end="0"/>
        <rae2 end="0"/>
        <lae2 end="0"/>
        <rae3 end="0"/>
        <lae3 end="0"/>
        <rae4 end="0"/>
        <lae4 end="0"/>

        <!-- zakladna poloha noh -->
        <rle1 end="0"/>
        <lle1 end="0"/>
        <rle2 end="0"/>
        <lle2 end="0"/>
        <rle6 end="0"/>
        <lle6 end="0"/>

        <!-- ruky dolu -->
        <rae1 end="-70"/>
        <lae1 end="-70"/>

        <!-- pokrcenie kolien -->
        <rle4 end="-60"/>
        <lle4 end="-60"/>

        <rle5 end="38"/>
        <lle5 end="38"/>

        <!-- torzo -->
        <rle3 end="30"/>
        <lle3 end="30"/>
      </effectors>
      <duration>220</duration>
    </phase>
    <phase name="kick_right_faster_Phase1" next="kick_right_faster_Phase2">
      <effectors>
        <!-- ruka -->
        <lae1 end="-90"/>
        <lae2 end="-40"/>

        <!-- clenky -->
        <rle6 end="14"/>
        <lle6 end="16"/>

        <!-- bedra -->
        <rle2 end="-12"/>
        <lle2 end="-13"/>

        <!-- torzo -->
        <rle3 end="45"/>
        <lle3 end="45"/>

        <rle4 end="-65"/>

      </effectors>
      <duration>250</duration>

    </phase>
    <phase name="kick_right_faster_Phase2" next="kick_right_faster_Phase3">
      <effectors>
        <!-- koleno+clenok -->
        <lle2 end="-10"/>
        <lle4 end="-30"/>
        <rle4 end="-80"/>
        <lle5 end="18"/>
        <rle5 end="40"/>
        <rle6 end="10"/>


        <!-- bedro -->
        <lle3 end="50"/>
        <rle3 end="-20"/>

      </effectors>
      <duration>300</duration>
    </phase>
    <phase name="kick_right_faster_Phase3" next="kick_right_faster_Phase4">
      <effectors>
        <!-- bedro -->
        <lle3 end="-60"/>
        <rle3 end="60"/>

        <!-- koleno -->
        <lle4 end="0"/>
        <rle4 end="-78"/>

        <!-- spicka -->
        <lle5 end="16"/>
        <rle5 end="25"/>
      </effectors>
      <duration>290</duration>
    </phase>
    <phase name="kick_right_faster_Phase4" next="kick_right_faster_Phase5">
      <effectors>
        <he1 end="0"/>
        <he2 end="0"/>
        <rae2 end="0"/>
        <lae2 end="0"/>
        <rae3 end="0"/>
        <lae3 end="0"/>
        <rae4 end="0"/>
        <lae4 end="0"/>

        <!-- zakladna poloha noh -->
        <rle1 end="0"/>
        <lle1 end="0"/>
        <rle2 end="0"/>
        <lle2 end="0"/>
        <rle6 end="0"/>
        <lle6 end="0"/>

        <!-- ruky dolu -->
        <rae1 end="-70"/>
        <lae1 end="-70"/>

        <!-- pokrcenie kolien -->
        <rle4 end="-60"/>
        <lle4 end="-60"/>

        <rle5 end="40"/>
        <lle5 end="40"/>

        <!-- torzo -->
        <rle3 end="30"/>
        <lle3 end="30"/>

      </effectors>
      <duration>400</duration>
    </phase>

    <phase name="kick_right_faster_Phase5" isFinal="true">
      <effectors>
        <he2 end="0"/>

        <rae1 end="-90"/>
        <lae1 end="-90"/>
        <rae2 end="-10"/>
        <lae2 end="10"/>
        <rae3 end="80"/>
        <lae3 end="-80"/>
        <rae4 end="60"/>
        <lae4 end="-60"/>

        <rle1 end="0"/>
        <lle1 end="0"/>
        <rle2 end="0"/>
        <lle2 end="0"/>
        <rle3 end="40"/>
        <lle3 end="40"/>
        <rle4 end="-60"/>
        <lle4 end="-60"/>
        <rle5 end="30"/>
        <lle5 end="30"/>
        <rle6 end="0"/>
        <lle6 end="0"/>
      </effectors>
      <duration>500</duration>
      <finalize>kick_right_faster_Phase6</finalize>
    </phase>
    <phase name="kick_right_faster_Phase6" isFinal="true">
      <effectors>

      </effectors>
      <duration>0</duration>
      <finalize>kick_right_faster_Phase0</finalize>
    </phase>
  </phases>
</robot>