<?xml version="1.0" encoding="UTF-8"?>
<robot xmlns:xsi="http://www.w3.org/2001/XMLSchema-instance"
	xsi:noNamespaceSchemaLocation="moves.xsd">
	<low_skills>
		<low_skill name="fall_front" firstPhase="fall_front">
			<type>fall</type>
			<author>Androids</author>
			<extendedFromMove></extendedFromMove>
			<description>Player falls to the front. Move is less effective.
			</description>
		</low_skill>
	</low_skills>

	<phases>
		<phase name="fall_front" next="fall_front1" isFinal="true">
			<effectors>
				<he1 end="0" />
				<he2 end="0" />
				<rae2 end="0" />
				<lae2 end="0" />
				<rae3 end="0" />
				<lae3 end="0" />
				<rae4 end="0" />
				<lae4 end="0" />
				<rle1 end="0" />
				<lle1 end="0" />
				<rle2 end="0" />
				<lle2 end="0" />
				<rle3 end="0" />
				<lle3 end="0" />
				<rle4 end="0" />
				<lle4 end="0" />
				<rle5 end="0" />
				<lle5 end="0" />
				<rle6 end="0" />
				<lle6 end="0" />
				<lae1 end="90" />
				<rae1 end="90" />
				<rle5 end="15" />
				<lle5 end="15" />
			</effectors>
			<duration>200</duration>
			<finalize>straighten</finalize>
		</phase>
		<phase name="fall_front1" next="fall_front2">
			<effectors>
				<rle5 end="20" />
				<lle5 end="20" />
			</effectors>
			<duration>200</duration>
		</phase>
		<phase name="fall_front2" isFinal="true">
			<effectors>
				<rle5 end="20" />
				<lle5 end="20" />
			</effectors>
			<duration>1000</duration>
			<finalize>fall_front2</finalize>
		</phase>
	</phases>
</robot>